{
    "game": "Secret of Evermore",
    "authors": [
        "black-sliver"
    ],
    "igdb_id": 1359,
    "world_version": "0.50.1",
    "minimum_ap_version": "0.4.2",
    "module_location": "https://github.com/lallaria/MultiworldGG/releases/download/worlds-seed-2026-05-11/worlds_soe-0.50.1-py3-none-any.whl#sha256=3043fdb7755814dc7c0e010ba3191e4acbb56ca5dc667aba068fd4e3e3d47135"
}
