{
    "game": "Chatipelago",
    "authors": [
        "Delilah",
        "Dranzior",
        "LMarioza"
    ],
    "igdb_id": 0,
    "minimum_ap_version": "0.6.0",
    "world_version": "0.0.1",
    "module_location": "https://github.com/lallaria/MultiworldGG/releases/download/worlds-seed-2026-05-11/worlds_chatipelago-0.0.1-py3-none-any.whl#sha256=8e3fb993903d0c6825027c0a388bf88132ee00e259589c29dbda5a0f2a5523bf"
}
