{
    "game": "Metroid: Zero Mission",
    "authors": [
        "lil David",
        "NoiseCrush"
    ],
    "igdb_id": 1107,
    "world_version": "0.5.2",
    "minimum_ap_version": "0.6.4",
    "compatible_version": 7,
    "version": 7,
    "module_location": "https://github.com/MultiworldGG/MultiworldGG/tree/worlds-mirror/worlds/mzm"
}
