{
    "game": "Yacht Dice",
    "authors": [
        "Spineraks"
    ],
    "igdb_id": 0,
    "minimum_ap_version": "0.6.1",
    "world_version": "2.3.3",
    "compatible_version": 7,
    "version": 7,
    "module_location": "https://github.com/MultiworldGG/MultiworldGG/tree/worlds-mirror/worlds/yachtdice"
}
