{
    "game": "ULTRAKILL",
    "world_version": "3.5.0",
    "authors": [
        "TRPG"
    ],
    "igdb_id": 124333,
    "minimum_ap_version": "0.6.4",
    "compatible_version": 7,
    "version": 7,
    "module_location": "https://github.com/MultiworldGG/MultiworldGG/tree/worlds-mirror/worlds/ultrakill"
}
