{
    "game": "Kirby's Dream Land 3",
    "authors": [
        "Silvris"
    ],
    "igdb_id": 3720,
    "minimum_ap_version": "0.6.4",
    "world_version": "0.0.1",
    "module_location": "https://github.com/lallaria/MultiworldGG/releases/download/worlds-seed-2026-05-11/worlds_kdl3-0.0.1-py3-none-any.whl#sha256=b8fe10c843eeceb38662e3a8a3208b839fb2a3f59f7cb384a16c56e666c97bc8"
}
