{
    "compatible_version": 7,
    "version": 7,
    "game": "Lethal Company",
    "authors": [
        "T0r1nn"
    ],
    "igdb_id": 212089,
    "world_version": "0.7.10",
    "module_location": "https://github.com/lallaria/MultiworldGG/releases/download/worlds-seed-2026-05-11/worlds_lethal_company-0.7.10-py3-none-any.whl#sha256=bb8dc493d4dbbd7b1ea4c646c8ed29e4d570f20f342a02badbeda8981602ae84"
}
