{
    "game": "Yoshi's Island",
    "authors": [
        "Pink Switch"
    ],
    "igdb_id": 1073,
    "minimum_ap_version": "0.6.3",
    "world_version": "1.0.0",
    "module_location": "https://github.com/lallaria/MultiworldGG/releases/download/worlds-seed-2026-05-11/worlds_yoshisisland-1.0.0-py3-none-any.whl#sha256=4acfa3b22328b4181478b9f08da27220d2a0a568046acd57afd0b79b289a4bd4"
}
