{
    "game": "Zelda II: The Adventure of Link",
    "authors": [
        "Pink Switch"
    ],
    "igdb_id": 1025,
    "minimum_ap_version": "0.6.4",
    "world_version": "0.0.1",
    "module_location": "https://github.com/lallaria/MultiworldGG/releases/download/worlds-seed-2026-05-11/worlds_zelda2-0.0.1-py3-none-any.whl#sha256=4af9b75d9a07e79db43dffc31977397335a8aac09ba1180801ae0cd910108af1"
}
