{
    "game": "Metroid Fusion",
    "authors": [
        "Rosalie"
    ],
    "igdb_id": 1104,
    "minimum_ap_version": "0.6.4",
    "world_version": "0.0.1",
    "module_location": "https://github.com/lallaria/MultiworldGG/releases/download/worlds-seed-2026-05-11/worlds_metroidfusion-0.0.1-py3-none-any.whl#sha256=caabf67d6889841b523767ad83f5e583c27fdb4b91aaadcd540ab46550813624"
}
