{
    "compatible_version": 7,
    "version": 7,
    "game": "CrossCode",
    "authors": [
        "CodeTriangle"
    ],
    "igdb_id": 35282,
    "world_version": "0.8.4",
    "module_location": "https://github.com/lallaria/MultiworldGG/releases/download/worlds-seed-2026-05-11/worlds_crosscode-0.8.4-py3-none-any.whl#sha256=d8107df301d0e327a71686f98e94f7564d36e91e03390e102a86ed1f03224b02"
}
