{
    "game": "Placid Plastic Duck Simulator",
    "authors": [
        "SW_CreeperKing"
    ],
    "igdb_id": 204122,
    "minimum_ap_version": "0.6.4",
    "world_version": "0.0.1",
    "module_location": "https://github.com/MultiworldGG/MultiworldGG/tree/worlds-mirror/worlds/placidplasticducksim"
}
