{
    "game": "Pokemon Red and Blue",
    "authors": [
        "Alchav"
    ],
    "igdb_id": 1561,
    "minimum_ap_version": "0.6.4",
    "world_version": "0.0.1",
    "compatible_version": 7,
    "version": 7,
    "module_location": "https://github.com/MultiworldGG/MultiworldGG/tree/worlds-mirror/worlds/pokemon_rb"
}
