{
    "game": "SMZ3",
    "authors": [
        "lordlou"
    ],
    "igdb_id": 210231,
    "minimum_ap_version": "0.6.4",
    "world_version": "0.0.2",
    "module_location": "https://github.com/lallaria/MultiworldGG/releases/download/worlds-seed-2026-05-11/worlds_smz3-0.0.2-py3-none-any.whl#sha256=aaff14af33566af41e0c39eaecdb562a1e77addeb2547b1a8bd11d5d4b1ca76f"
}
