{
    "game": "Lufia II: Ancient Cave",
    "authors": [
        "el-u",
        "word_fcuk"
    ],
    "igdb_id": 1178,
    "minimum_ap_version": "0.6.4",
    "world_version": "0.0.2",
    "module_location": "https://github.com/lallaria/MultiworldGG/releases/download/worlds-seed-2026-05-11/worlds_lufia2ac-0.0.2-py3-none-any.whl#sha256=49fa2c9ee1fd2b60fb680546163a5eee32af3c7450518c458199849f30a811fa"
}
