{
    "game": "Battle for Bikini Bottom",
    "minimum_ap_version": "0.6.2",
    "world_version": "1.2.4",
    "authors": [
        "Cyb3R"
    ],
    "igdb_id": 2765,
    "compatible_version": 7,
    "version": 7,
    "module_location": "https://github.com/lallaria/MultiworldGG/releases/download/worlds-seed-2026-05-11/worlds_bfbb-1.2.4-py3-none-any.whl#sha256=4a839150400462cc502255aa2118f615b812a0434c41abfa4005bf87861807d2"
}
