{
    "game": "Twilight Princess",
    "authors": [
        "WritingHusky"
    ],
    "igdb_id": 134014,
    "minimum_ap_version": "0.6.4",
    "world_version": "0.3.2",
    "module_location": "https://github.com/lallaria/MultiworldGG/releases/download/worlds-seed-2026-05-11/worlds_tp-0.3.2-py3-none-any.whl#sha256=24b73583fc7d4c2ab511978a0bb0e7ff49c6103278e3b8f40a765049ff8d9acb"
}
