{
    "game": "Banjo-Tooie",
    "authors": [
        "jjjj12212",
        "g0goTBC",
        "Austin"
    ],
    "igdb_id": 3418,
    "minimum_ap_version": "0.6.3",
    "world_version": "4.11.5",
    "compatible_version": 7,
    "version": 7,
    "module_location": "https://github.com/lallaria/MultiworldGG/releases/download/worlds-seed-2026-05-11/worlds_banjo_tooie-4.11.5-py3-none-any.whl#sha256=1de3aab2504cfedd43d20b34f9716e6e1c2b429bee0d58780b119eeb80a85cc3"
}
