{
    "game": "Civilization VI",
    "authors": [
        "hesto2"
    ],
    "igdb_id": 293,
    "minimum_ap_version": "0.6.4",
    "world_version": "0.0.1",
    "module_location": "https://github.com/lallaria/MultiworldGG/releases/download/worlds-seed-2026-05-11/worlds_civ_6-0.0.1-py3-none-any.whl#sha256=e0c6c31130671dfbce15814e77e4fc88aba53cb30ac7e25161b659be78d59b62"
}
